{
  "config_id": "shezan-cakes-and-snacks-mallepally",
  "version": "1.0",
  "address": {
    "label": "Shezan Cakes and Snacks, Mallepally",
    "formal_address": "11, 3-913/1, Jamia Masjid Rd, Mozampura, Mallepally, New Mallepally, Hyderabad, Telangana 500001",
    "city": "Hyderabad",
    "region_code": "IN"
  },
  "landmark": {
    "name": "Jamia Masjid Mallepally",
    "type": "mosque"
  },
  "building_description": {
    "distinguishing_features": [
      "Sits directly on a traffic circle/roundabout — not a straight stretch of road",
      "Commercial bakery storefront right at the edge of the circle",
      "Clear 'Shezan Cakes And Snack' branding and display counters visible from the street"
    ]
  },
  "approach_from": [
    {
      "direction_label": "Coming from Amba Hospital / New Riyan Hotel side (northwest)",
      "instructions": "Head down Raj Janaki Prasad Road until you reach a large roundabout/traffic circle. The shop is right on the circle.",
      "landmark_sequence": ["Amba Hospital", "New Riyan Hotel"]
    },
    {
      "direction_label": "Coming from Hadi Hospital / Moghal Ground side (east)",
      "instructions": "Head down Jamia Masjid Road towards the roundabout/traffic circle — the shop is right on the circle, roughly opposite the side you're entering from.",
      "landmark_sequence": ["Hadi Hospital", "Moghal Ground"]
    },
    {
      "direction_label": "Coming from Anwarul Uloom College of Pharmacy side (south)",
      "instructions": "Head north until you reach the roundabout/traffic circle. The shop sits on the circle itself.",
      "landmark_sequence": ["Anwarul Uloom College of Pharmacy"]
    }
  ],
  "entrance_details": {
    "location": "Main road-facing storefront entrance",
    "identifying_marks": "Large 'Shezan Cakes And Snack' signage above the entrance",
    "access_notes": "Ground-floor commercial street access, direct walk-in during business hours — no gate, no security, no floor/unit navigation needed"
  },
  "escalation": {
    "trigger_conditions": [
      "Driver still can't locate the storefront after being guided through both approach directions",
      "Driver reports the shop signage or the mosque is no longer visible/recognizable"
    ],
    "contact": {
      "contact_name": "the shop owner",
      "recipient_phone": "+14155550199"
    }
  },
  "language": {
    "locale": "hi-IN",
    "allow_code_switch": true
  },
  "metadata": {
    "created_at": "2026-08-23",
    "last_verified_at": "2026-08-23"
  }
}
